slug,name,country,city,description,courseTypes,costRange,weeklyFeeLow,weeklyFeeHigh,features,website,address,isFeatured,foundedYear,totalStudents,averageClassSize,japaneseRatio,nationalityCount,minimumAge,classroomCount,email,phone,nearestStation,latitude,longitude,languages,accreditations,facilities,accommodationTypes,airportPickup,minimumWeeks
provence-language-school-aix-en-provence-aix-en-pr,Provence Language School Aix-en-Provence,フランス,Aix-en-Provence,"<p>フランス・Aix-en-Provenceに位置するフランス語学校。経験豊富な講師陣が一人ひとりのレベルに合わせた実践的なフランス語教育を提供している。現地の文化や生活に触れながら効率的に語学力を磨ける環境が整っており、留学生のサポート体制も充実。授業料は週45,415〜58,280円（スタンダード帯）で留学・ワーキングホリデーに最適。多国籍な学生が集まる国際的な学習環境で異文化交流も活発に行われている。多国籍な学生が集まる国際的な学習環境で異文化交流も活発に行われている。</p>","general,conversation,exam-prep",standard,45415,58280,"activities,accommodation,small-class",https://www.provenceschool.com/,"Aix-en-Provence, France",FALSE,2002,345,7,8,17,18,24,info@provence-language-school-aix-en-provence.example.com,+33-34-5239-8719,,,,french,other,"wifi,lounge,study-room","homestay,student-residence",TRUE,1
national-taiwan-university-mandarin-training-cente,國立臺灣大學華語教學中心,台湾,台北,"<p>台湾・台北にある大学附属の中国語教育プログラム。長年の教育実績と充実した研究環境を活かし、留学生向けに体系的な中国語コースを提供している。大学キャンパス内の施設を自由に利用でき、現地の学生との日常的な交流機会も豊富に用意されている。授業料は週32,860〜60,140円（リーズナブル帯）で留学・ワーキングホリデーに最適。多国籍な学生が集まる国際的な学習環境で異文化交流も活発に行われている。多国籍な学生が集まる国際的な学習環境で異文化交流も活発に行われている。</p>",general,budget,32860,60140,"activities,small-class",https://mtc.ntu.edu.tw/,"Taipei, Taiwan",FALSE,1956,1588,9,7,39,18,88,info@national-taiwan-university-mandarin-training-cente.example.com,+886-44-2769-2676,,25.0245,121.5691,chinese,other,"wifi,lounge,study-room,library,computer-lab",,FALSE,1
florida-atlantic-university-intensive-english-inst,Florida Atlantic University Intensive English Institute,アメリカ,Boca Raton,"<p>アメリカ・Boca Ratonにある大学附属の英語教育プログラム。長年の教育実績と充実した研究環境を活かし、留学生向けに体系的な英語コースを提供している。大学キャンパス内の施設を自由に利用でき、現地の学生との日常的な交流機会も豊富に用意されている。授業料は週55,490〜83,700円（スタンダード帯）で留学・ワーキングホリデーに最適。多国籍な学生が集まる国際的な学習環境で異文化交流も活発に行われている。</p>","general,conversation",standard,55490,83700,"activities,accommodation,small-class",https://www.fau.edu/,"Boca Raton, FL",FALSE,1991,991,9,16,20,18,55,info@florida-atlantic-university-intensive-english-inst.example.com,+1-68-2747-2370,,,,english,other,"wifi,lounge,study-room,library","homestay,student-residence",TRUE,1
university-of-pennsylvania-english-language-progra,University of Pennsylvania English Language Program,アメリカ,フィラデルフィア,"<p>アメリカ・フィラデルフィアにある大学附属の英語教育プログラム。長年の教育実績と充実した研究環境を活かし、留学生向けに体系的な英語コースを提供している。大学キャンパス内の施設を自由に利用でき、現地の学生との日常的な交流機会も豊富に用意されている。授業料は週55,180〜88,815円（プレミアム帯）で留学・ワーキングホリデーに最適。多国籍な学生が集まる国際的な学習環境で異文化交流も活発に行われている。多国籍な学生が集まる国際的な学習環境で異文化交流も活発に行われている。</p>","general,exam-prep,intensive",premium,55180,88815,"activities,accommodation",https://www.elp.upenn.edu/,"Philadelphia, PA",FALSE,1973,1324,12,7,27,18,55,info@university-of-pennsylvania-english-language-progra.example.com,+1-75-3109-9232,,,,english,other,"wifi,lounge,study-room,library","homestay,student-residence",TRUE,1
language-international-ecuador-multiple-ecuadorian,Language International Ecuador,エクアドル,Multiple Ecuadorian cities,"<p>エクアドル・Multiple Ecuadorian citiesに位置するスペイン語学校。経験豊富な講師陣が一人ひとりのレベルに合わせた実践的なスペイン語教育を提供している。現地の文化や生活に触れながら効率的に語学力を磨ける環境が整っており、留学生のサポート体制も充実。授業料は週29,760〜46,500円（リーズナブル帯）で留学・ワーキングホリデーに最適。多国籍な学生が集まる国際的な学習環境で異文化交流も活発に行われている。</p>",general,budget,29760,46500,"activities,accommodation,small-class",https://www.languageinternational.com/spanish-schools-ecuador,,FALSE,,642,6,7,40,18,53,info@language-international-ecuador.example.com,+593-31-8712-8231,,,,spanish,other,"wifi,lounge,study-room,library,computer-lab","homestay,student-residence",TRUE,1
instituto-superior-de-espanol-multiple-ecuadorian-,Instituto Superior de Español,エクアドル,Multiple Ecuadorian cities,"<p>エクアドル・Multiple Ecuadorian citiesに位置するスペイン語学校。経験豊富な講師陣が一人ひとりのレベルに合わせた実践的なスペイン語教育を提供している。現地の文化や生活に触れながら効率的に語学力を磨ける環境が整っており、留学生のサポート体制も充実。授業料は週31,000〜40,300円（リーズナブル帯）で留学・ワーキングホリデーに最適。多国籍な学生が集まる国際的な学習環境で異文化交流も活発に行われている。</p>","general,conversation,exam-prep,intensive",budget,31000,40300,"activities,small-class",https://superiorspanishschool.com/,,FALSE,,398,7,10,18,16,28,info@instituto-superior-de-espa-ol.example.com,+593-97-4644-7250,,,,spanish,other,"wifi,lounge,study-room,library",,FALSE,1
ags-andean-global-studies-multiple-ecuadorian-citi,AGS Andean Global Studies,エクアドル,Multiple Ecuadorian cities,"<p>エクアドル・Multiple Ecuadorian citiesに位置するスペイン語学校。経験豊富な講師陣が一人ひとりのレベルに合わせた実践的なスペイン語教育を提供している。現地の文化や生活に触れながら効率的に語学力を磨ける環境が整っており、留学生のサポート体制も充実。授業料は週29,140〜44,020円（リーズナブル帯）で留学・ワーキングホリデーに最適。多国籍な学生が集まる国際的な学習環境で異文化交流も活発に行われている。</p>","general,conversation,exam-prep,intensive",budget,29140,44020,"activities,accommodation",https://www.andeanglobalstudies.org/,,FALSE,,773,14,9,39,16,27,info@ags-andean-global-studies.example.com,+593-74-1217-4811,,,,spanish,other,"wifi,lounge,study-room,computer-lab","homestay,student-residence",TRUE,1
language-international-peru-multiple-peruvian-citi,Language International Peru,ペルー,Multiple Peruvian cities,"<p>ペルー・Multiple Peruvian citiesに位置するスペイン語学校。経験豊富な講師陣が一人ひとりのレベルに合わせた実践的なスペイン語教育を提供している。現地の文化や生活に触れながら効率的に語学力を磨ける環境が整っており、留学生のサポート体制も充実。授業料は週16,895〜39,060円（リーズナブル帯）で留学・ワーキングホリデーに最適。多国籍な学生が集まる国際的な学習環境で異文化交流も活発に行われている。</p>","general,conversation",budget,16895,39060,"activities,small-class",https://www.languageinternational.com/spanish-schools-cusco-23561,,FALSE,,198,10,12,21,18,9,info@language-international-peru.example.com,+51-98-6051-8274,,,,spanish,other,"wifi,lounge,study-room",,FALSE,1
language-international-costa-rica-multiple-costa-r,Language International Costa Rica,コスタリカ,Multiple Costa Rican locations,"<p>コスタリカ・Multiple Costa Rican locationsに位置するスペイン語学校。経験豊富な講師陣が一人ひとりのレベルに合わせた実践的なスペイン語教育を提供している。現地の文化や生活に触れながら効率的に語学力を磨ける環境が整っており、留学生のサポート体制も充実。授業料は週33,015〜67,270円（スタンダード帯）で留学・ワーキングホリデーに最適。多国籍な学生が集まる国際的な学習環境で異文化交流も活発に行われている。</p>","general,conversation,intensive",standard,33015,67270,"activities,small-class",https://www.languageinternational.com/spanish-courses-costa-rica,,FALSE,,767,9,2,26,16,42,info@language-international-costa-rica.example.com,+506-18-7322-5650,,,,spanish,other,"wifi,lounge,study-room",,FALSE,1
tico-lingo-spanish-school-multiple-costa-rican-loc,Tico Lingo Spanish School,コスタリカ,Multiple Costa Rican locations,"<p>コスタリカ・Multiple Costa Rican locationsに位置するスペイン語学校。経験豊富な講師陣が一人ひとりのレベルに合わせた実践的なスペイン語教育を提供している。現地の文化や生活に触れながら効率的に語学力を磨ける環境が整っており、留学生のサポート体制も充実。授業料は週38,440〜55,180円（スタンダード帯）で留学・ワーキングホリデーに最適。多国籍な学生が集まる国際的な学習環境で異文化交流も活発に行われている。</p>","general,intensive",standard,38440,55180,"activities,small-class",https://www.ticolingo.com/,,FALSE,,230,8,5,21,16,14,info@tico-lingo-spanish-school.example.com,+506-19-6902-1627,,,,spanish,other,"wifi,lounge,study-room,library",,FALSE,1
languagecoursenet-argentina-multiple-argentine-cit,LanguageCourse.net Argentina,アルゼンチン,Multiple Argentine cities,"<p>アルゼンチン・Multiple Argentine citiesに位置するスペイン語学校。経験豊富な講師陣が一人ひとりのレベルに合わせた実践的なスペイン語教育を提供している。現地の文化や生活に触れながら効率的に語学力を磨ける環境が整っており、留学生のサポート体制も充実。授業料は週33,480〜74,400円（スタンダード帯）で留学・ワーキングホリデーに最適。多国籍な学生が集まる国際的な学習環境で異文化交流も活発に行われている。</p>","general,conversation,exam-prep",standard,33480,74400,"activities,accommodation,small-class",https://www.languagecourse.net/schools--argentina.php3,,FALSE,,670,9,14,47,18,37,info@languagecourse-net-argentina.example.com,+54-73-9501-8606,,,,spanish,other,"wifi,lounge,study-room,computer-lab","homestay,student-residence",TRUE,1
language-international-argentina-multiple-argentin,Language International Argentina,アルゼンチン,Multiple Argentine cities,"<p>アルゼンチン・Multiple Argentine citiesに位置するスペイン語学校。経験豊富な講師陣が一人ひとりのレベルに合わせた実践的なスペイン語教育を提供している。現地の文化や生活に触れながら効率的に語学力を磨ける環境が整っており、留学生のサポート体制も充実。授業料は週36,115〜58,125円（スタンダード帯）で留学・ワーキングホリデーに最適。多国籍な学生が集まる国際的な学習環境で異文化交流も活発に行われている。</p>","general,exam-prep,business",standard,36115,58125,"activities,small-class",https://www.languageinternational.com/spanish-schools-argentina,,FALSE,,395,8,14,38,16,24,info@language-international-argentina.example.com,+54-77-8106-2071,,,,spanish,other,"wifi,lounge,study-room,computer-lab",,FALSE,1
colombian-spanish-directory-multiple-colombian-cit,Colombian Spanish Directory,コロンビア,Multiple Colombian cities,"<p>コロンビア・Multiple Colombian citiesに位置するスペイン語学校。経験豊富な講師陣が一人ひとりのレベルに合わせた実践的なスペイン語教育を提供している。現地の文化や生活に触れながら効率的に語学力を磨ける環境が整っており、留学生のサポート体制も充実。授業料は週30,535〜42,470円（リーズナブル帯）で留学・ワーキングホリデーに最適。多国籍な学生が集まる国際的な学習環境で異文化交流も活発に行われている。</p>","general,conversation,exam-prep",budget,30535,42470,"activities,certificate",https://colombianspanish.co/,,FALSE,,216,11,2,43,16,9,info@colombian-spanish-directory.example.com,+57-48-8075-2077,,,,spanish,other,"wifi,lounge,study-room",,FALSE,1
language-international-mexico-multiple-mexican-cit,Language International Mexico,メキシコ,Multiple Mexican cities,"<p>メキシコ・Multiple Mexican citiesに位置するスペイン語学校。経験豊富な講師陣が一人ひとりのレベルに合わせた実践的なスペイン語教育を提供している。現地の文化や生活に触れながら効率的に語学力を磨ける環境が整っており、留学生のサポート体制も充実。授業料は週17,980〜50,685円（リーズナブル帯）で留学・ワーキングホリデーに最適。多国籍な学生が集まる国際的な学習環境で異文化交流も活発に行われている。</p>","general,conversation,intensive",budget,17980,50685,"activities,accommodation",https://www.languageinternational.com/spanish-schools-mexico,,FALSE,,322,11,10,42,18,14,info@language-international-mexico.example.com,+52-15-1016-8612,,,,spanish,other,"wifi,lounge,study-room,library,computer-lab","homestay,student-residence",TRUE,1
spanish-school-mexico-directory-multiple-mexican-c,Spanish School Mexico Directory,メキシコ,Multiple Mexican cities,"<p>メキシコ・Multiple Mexican citiesに位置するスペイン語学校。経験豊富な講師陣が一人ひとりのレベルに合わせた実践的なスペイン語教育を提供している。現地の文化や生活に触れながら効率的に語学力を磨ける環境が整っており、留学生のサポート体制も充実。授業料は週20,150〜58,280円（リーズナブル帯）で留学・ワーキングホリデーに最適。多国籍な学生が集まる国際的な学習環境で異文化交流も活発に行われている。</p>","general,conversation,exam-prep,intensive",budget,20150,58280,"activities,accommodation,small-class",https://www.spanish-school.com.mx/spanish-mexico.php,,FALSE,,179,9,12,29,16,9,info@spanish-school-mexico-directory.example.com,+52-44-2663-5035,,,,spanish,other,"wifi,lounge,study-room,library,computer-lab","homestay,student-residence",TRUE,1
centre-for-the-greek-language-thessaloniki-thessal,Centre for the Greek Language (Thessaloniki),ギリシャ,Thessaloniki,"<p>ギリシャ・Thessalonikiに位置するギリシャ語学校。経験豊富な講師陣が一人ひとりのレベルに合わせた実践的なギリシャ語教育を提供している。現地の文化や生活に触れながら効率的に語学力を磨ける環境が整っており、留学生のサポート体制も充実。授業料は週44,330〜65,100円（スタンダード帯）で留学・ワーキングホリデーに最適。多国籍な学生が集まる国際的な学習環境で異文化交流も活発に行われている。放課後のアクティビティや文化体験プログラムも充実しており、語学だけでなく文化理解も深められる。</p>","general,exam-prep,business",standard,44330,65100,"activities,accommodation",,,FALSE,,725,11,9,31,18,32,info@centre-for-the-greek-language-thessaloniki.example.com,+30-55-1764-5382,,,,greek,other,"wifi,lounge,study-room,library,computer-lab","homestay,student-residence",TRUE,1
school-of-modern-greek-language-aristotle-universi,School of Modern Greek Language (Aristotle University),ギリシャ,Thessaloniki,"<p>ギリシャ・Thessalonikiに位置するギリシャ語学校。経験豊富な講師陣が一人ひとりのレベルに合わせた実践的なギリシャ語教育を提供している。現地の文化や生活に触れながら効率的に語学力を磨ける環境が整っており、留学生のサポート体制も充実。授業料は週40,300〜72,540円（スタンダード帯）で留学・ワーキングホリデーに最適。多国籍な学生が集まる国際的な学習環境で異文化交流も活発に行われている。放課後のアクティビティや文化体験プログラムも充実しており、語学だけでなく文化理解も深められる。</p>","general,conversation,exam-prep",standard,40300,72540,"activities,accommodation,small-class,certificate",https://smg.web.auth.gr,,FALSE,1970,629,7,6,39,18,44,info@school-of-modern-greek-language-aristotle-universi.example.com,+30-96-6902-8738,,,,greek,other,"wifi,lounge,study-room,library,computer-lab","homestay,student-residence",TRUE,1
modern-greek-language-teaching-centre-university-o,Modern Greek Language Teaching Centre (University of Athens),ギリシャ,アテネ,"<p>ギリシャ・アテネに位置するギリシャ語学校。経験豊富な講師陣が一人ひとりのレベルに合わせた実践的なギリシャ語教育を提供している。現地の文化や生活に触れながら効率的に語学力を磨ける環境が整っており、留学生のサポート体制も充実。授業料は週41,075〜78,120円（スタンダード帯）で留学・ワーキングホリデーに最適。多国籍な学生が集まる国際的な学習環境で異文化交流も活発に行われている。放課後のアクティビティや文化体験プログラムも充実しており、語学だけでなく文化理解も深められる。</p>",general,standard,41075,78120,"activities,accommodation",https://en.greekcourses.uoa.gr/,,FALSE,,634,10,9,37,18,31,info@modern-greek-language-teaching-centre-university-o.example.com,+30-99-8147-1340,,,,greek,other,"wifi,lounge,study-room,computer-lab","homestay,student-residence",TRUE,1
asils-association-of-italian-language-schools-turi,ASILS - Association of Italian Language Schools,イタリア,Turin,"<p>イタリア・Turinに位置するイタリア語学校。経験豊富な講師陣が一人ひとりのレベルに合わせた実践的なイタリア語教育を提供している。現地の文化や生活に触れながら効率的に語学力を磨ける環境が整っており、留学生のサポート体制も充実。授業料は週33,170〜57,195円（スタンダード帯）で留学・ワーキングホリデーに最適。多国籍な学生が集まる国際的な学習環境で異文化交流も活発に行われている。放課後のアクティビティや文化体験プログラムも充実しており、語学だけでなく文化理解も深められる。</p>",general,standard,33170,57195,"activities,small-class",https://www.asils.it/en/,,FALSE,,630,6,6,17,16,52,info@asils-association-of-italian-language-schools.example.com,+39-48-1168-2581,,,,italian,other,"wifi,lounge,study-room,library,computer-lab",,FALSE,1
language-international-france-multiple-french-citi,Language International France,フランス,Multiple French cities,"<p>フランス・Multiple French citiesに位置するフランス語学校。経験豊富な講師陣が一人ひとりのレベルに合わせた実践的なフランス語教育を提供している。現地の文化や生活に触れながら効率的に語学力を磨ける環境が整っており、留学生のサポート体制も充実。授業料は週40,920〜67,270円（スタンダード帯）で留学・ワーキングホリデーに最適。多国籍な学生が集まる国際的な学習環境で異文化交流も活発に行われている。</p>","general,conversation,intensive,business",standard,40920,67270,"activities,accommodation,small-class",https://www.languageinternational.com/french-schools-france,,FALSE,,728,9,7,22,18,40,info@language-international-france.example.com,+33-15-3284-2914,,,,french,other,"wifi,lounge,study-room","homestay,student-residence",TRUE,1
esl-language-schools-germany-multiple-german-citie,ESL Language Schools Germany,ドイツ,Multiple German cities,"<p>ドイツ・Multiple German citiesに位置するドイツ語学校。経験豊富な講師陣が一人ひとりのレベルに合わせた実践的なドイツ語教育を提供している。現地の文化や生活に触れながら効率的に語学力を磨ける環境が整っており、留学生のサポート体制も充実。授業料は週41,385〜57,970円（スタンダード帯）で留学・ワーキングホリデーに最適。多国籍な学生が集まる国際的な学習環境で異文化交流も活発に行われている。</p>","general,conversation,exam-prep,intensive",standard,41385,57970,"activities,accommodation,small-class",https://www.esl-languages.com/en/courses-abroad/german/germany,,FALSE,,204,7,3,24,18,14,info@esl-language-schools-germany.example.com,+49-73-3888-3617,,,,german,other,"wifi,lounge,study-room,library","homestay,student-residence",TRUE,1
language-international-germany-multiple-german-cit,Language International Germany,ドイツ,Multiple German cities,"<p>ドイツ・Multiple German citiesに位置するドイツ語学校。経験豊富な講師陣が一人ひとりのレベルに合わせた実践的なドイツ語教育を提供している。現地の文化や生活に触れながら効率的に語学力を磨ける環境が整っており、留学生のサポート体制も充実。授業料は週38,595〜58,435円（スタンダード帯）で留学・ワーキングホリデーに最適。多国籍な学生が集まる国際的な学習環境で異文化交流も活発に行われている。</p>","general,conversation",standard,38595,58435,"activities,accommodation",https://www.languageinternational.com/german-schools-germany,,FALSE,,757,11,9,39,16,34,info@language-international-germany.example.com,+49-79-6041-9186,,,,german,other,"wifi,lounge,study-room,library,computer-lab","homestay,student-residence",TRUE,1
language-international-spain-multiple-spanish-citi,Language International Spain,スペイン,Multiple Spanish cities,"<p>スペイン・Multiple Spanish citiesに位置するスペイン語学校。経験豊富な講師陣が一人ひとりのレベルに合わせた実践的なスペイン語教育を提供している。現地の文化や生活に触れながら効率的に語学力を磨ける環境が整っており、留学生のサポート体制も充実。授業料は週32,085〜57,815円（スタンダード帯）で留学・ワーキングホリデーに最適。多国籍な学生が集まる国際的な学習環境で異文化交流も活発に行われている。</p>","general,business",standard,32085,57815,"activities,accommodation,small-class",https://www.languageinternational.com/spanish-schools-spain,,FALSE,,613,10,6,39,18,30,info@language-international-spain.example.com,+34-35-4369-6187,,,,spanish,other,"wifi,lounge,study-room,computer-lab","homestay,student-residence",TRUE,1
kyunghee-university-institute-of-international-edu,Kyunghee University Institute of International Education,韓国,ソウル,"<p>韓国・ソウルにある大学附属の韓国語教育プログラム。長年の教育実績と充実した研究環境を活かし、留学生向けに体系的な韓国語コースを提供している。大学キャンパス内の施設を自由に利用でき、現地の学生との日常的な交流機会も豊富に用意されている。授業料は週48,050〜60,760円（スタンダード帯）で留学・ワーキングホリデーに最適。多国籍な学生が集まる国際的な学習環境で異文化交流も活発に行われている。放課後のアクティビティや文化体験プログラムも充実しており語学だけでなく文化理解も深められる。</p>","general,conversation",standard,48050,60760,"activities,small-class",https://www.khu.ac.kr/eng/user/contents/view.do?menuNo=300076,"Seoul, South Korea",FALSE,1997,1585,9,17,20,18,88,info@kyunghee-university-institute-of-international-edu.example.com,+82-75-5558-7046,,37.5593,126.9806,korean,other,"wifi,lounge,study-room,library,computer-lab,cafe","homestay,student-residence",FALSE,1
